{
 "schema_version": "3.0",
 "id": "GC-G9-010",
 "gate": "GATE-G9",
 "description": "Mindestdauer fehlt",
 "facts": {
  "gate_g8": "PASS",
  "months_standard": 11,
  "hard_limit_breaches": 0,
  "ladder_violations": 0,
  "severe_incidents": 0,
  "posterior_p_negative": 0.2,
  "inputs": {
   "X-OP-CAPITAL": "BESTAETIGT",
   "X-OP-RISK-ACCEPT": "BESTAETIGT",
   "X-OP-DLC-MODE": "BESTAETIGT",
   "X-OP-RATE": "BESTAETIGT",
   "X-OP-BUDGET": "BESTAETIGT",
   "X-OP-CFD": "BESTAETIGT",
   "X-SCOPE-THIRD": "BESTAETIGT",
   "X-EQ-INDEX": "BESTAETIGT",
   "X-INF-ZONES": "BESTAETIGT",
   "X-INF-VPS": "BESTAETIGT",
   "X-ORG-RISK": "BESTAETIGT",
   "X-ORG-DEPUTY": "BESTAETIGT",
   "X-BRK-ACCOUNT": "BESTAETIGT",
   "X-BRK-CONTRACTS": "BESTAETIGT",
   "X-BRK-FEES": "BESTAETIGT",
   "X-BRK-MARGIN": "BESTAETIGT",
   "X-BRK-LIQ": "BESTAETIGT",
   "X-BRK-NACHSCHUSS": "BESTAETIGT",
   "X-BRK-API": "BESTAETIGT",
   "X-BRK-DEMO": "BESTAETIGT",
   "X-BRK-INTEREST": "BESTAETIGT",
   "X-BRK-ALT": "BESTAETIGT",
   "X-DATA-ND": "BESTAETIGT",
   "X-DATA-LIC": "BESTAETIGT",
   "X-DATA-VOL": "BESTAETIGT",
   "X-DATA-LIQ": "BESTAETIGT",
   "X-DATA-HIST": "BESTAETIGT",
   "X-EXEC-TCA": "BESTAETIGT",
   "X-CFD-SPREADS": "BESTAETIGT",
   "X-AI-DPA": "BESTAETIGT",
   "X-LEGAL-01": "BESTAETIGT",
   "X-TAX-01": "BESTAETIGT",
   "X-V1-PRODUCTS": "BESTAETIGT",
   "X-REVIEW": "BESTAETIGT"
  }
 },
 "expect_outcome": "INCONCLUSIVE",
 "expect_rule": "G9-R5"
}
