{
 "schema_version": "3.0",
 "id": "GC-G3-006",
 "gate": "GATE-G3",
 "description": "Voraussetzung PRE-G3-4 verletzt: externe Eingabe X-DATA-LIQ bestätigt (Gemessene Liquiditätsfenster je Instrument)",
 "facts": {
  "gate_g2": "PASS",
  "manifest_registered_before_results": true,
  "trials_used": 12,
  "run_exit_code": 0,
  "reference_equality": true,
  "dsr": 0.97,
  "pbo": 0.1,
  "spa_p": 0.02,
  "p_predictive_final": 0.3,
  "turnover_ratio": 1.1,
  "neighbors_same_sign": true,
  "subperiods_same_sign": true,
  "inputs": {
   "X-OP-CAPITAL": "BESTAETIGT",
   "X-OP-RISK-ACCEPT": "BESTAETIGT",
   "X-OP-DLC-MODE": "BESTAETIGT",
   "X-OP-RATE": "BESTAETIGT",
   "X-OP-BUDGET": "BESTAETIGT",
   "X-OP-CFD": "BESTAETIGT",
   "X-SCOPE-THIRD": "BESTAETIGT",
   "X-EQ-INDEX": "BESTAETIGT",
   "X-INF-ZONES": "BESTAETIGT",
   "X-INF-VPS": "BESTAETIGT",
   "X-ORG-RISK": "BESTAETIGT",
   "X-ORG-DEPUTY": "BESTAETIGT",
   "X-BRK-ACCOUNT": "BESTAETIGT",
   "X-BRK-CONTRACTS": "BESTAETIGT",
   "X-BRK-FEES": "BESTAETIGT",
   "X-BRK-MARGIN": "BESTAETIGT",
   "X-BRK-LIQ": "BESTAETIGT",
   "X-BRK-NACHSCHUSS": "BESTAETIGT",
   "X-BRK-API": "BESTAETIGT",
   "X-BRK-DEMO": "BESTAETIGT",
   "X-BRK-INTEREST": "BESTAETIGT",
   "X-BRK-ALT": "BESTAETIGT",
   "X-DATA-ND": "BESTAETIGT",
   "X-DATA-LIC": "BESTAETIGT",
   "X-DATA-VOL": "BESTAETIGT",
   "X-DATA-LIQ": "UNBESTAETIGT",
   "X-DATA-HIST": "BESTAETIGT",
   "X-EXEC-TCA": "BESTAETIGT",
   "X-CFD-SPREADS": "BESTAETIGT",
   "X-AI-DPA": "BESTAETIGT",
   "X-LEGAL-01": "BESTAETIGT",
   "X-TAX-01": "BESTAETIGT",
   "X-V1-PRODUCTS": "BESTAETIGT",
   "X-REVIEW": "BESTAETIGT"
  }
 },
 "expect_outcome": "BLOCKED_EXTERNAL",
 "expect_rule": "PRE-G3-4"
}
