{
 "schema_version": "3.0",
 "id": "GC-G8-008",
 "gate": "GATE-G8",
 "description": "Voraussetzung PRE-G8-5 verletzt: externe Eingabe X-OP-DLC-MODE bestätigt (Auslegung der 9-%-Tagesgrenze (streng oder mit ausgewiesener Restwahrscheinlichkeit))",
 "facts": {
  "gate_g7": "PASS",
  "g1_realmoney_blocked": false,
  "pilot_grant_valid": true,
  "hardware_keys_registered": true,
  "months_pilot": 6.2,
  "pilot_loss_share": 0.03,
  "sr_pilot_est": 0.3,
  "hard_limit_breaches": 0,
  "costdrift_triggered": false,
  "posterior_p_positive": 0.85,
  "inputs": {
   "X-OP-CAPITAL": "BESTAETIGT",
   "X-OP-RISK-ACCEPT": "BESTAETIGT",
   "X-OP-DLC-MODE": "UNBESTAETIGT",
   "X-OP-RATE": "BESTAETIGT",
   "X-OP-BUDGET": "BESTAETIGT",
   "X-OP-CFD": "BESTAETIGT",
   "X-SCOPE-THIRD": "BESTAETIGT",
   "X-EQ-INDEX": "BESTAETIGT",
   "X-INF-ZONES": "BESTAETIGT",
   "X-INF-VPS": "BESTAETIGT",
   "X-ORG-RISK": "BESTAETIGT",
   "X-ORG-DEPUTY": "BESTAETIGT",
   "X-BRK-ACCOUNT": "BESTAETIGT",
   "X-BRK-CONTRACTS": "BESTAETIGT",
   "X-BRK-FEES": "BESTAETIGT",
   "X-BRK-MARGIN": "BESTAETIGT",
   "X-BRK-LIQ": "BESTAETIGT",
   "X-BRK-NACHSCHUSS": "BESTAETIGT",
   "X-BRK-API": "BESTAETIGT",
   "X-BRK-DEMO": "BESTAETIGT",
   "X-BRK-INTEREST": "BESTAETIGT",
   "X-BRK-ALT": "BESTAETIGT",
   "X-DATA-ND": "BESTAETIGT",
   "X-DATA-LIC": "BESTAETIGT",
   "X-DATA-VOL": "BESTAETIGT",
   "X-DATA-LIQ": "BESTAETIGT",
   "X-DATA-HIST": "BESTAETIGT",
   "X-EXEC-TCA": "BESTAETIGT",
   "X-CFD-SPREADS": "BESTAETIGT",
   "X-AI-DPA": "BESTAETIGT",
   "X-LEGAL-01": "BESTAETIGT",
   "X-TAX-01": "BESTAETIGT",
   "X-V1-PRODUCTS": "BESTAETIGT",
   "X-REVIEW": "BESTAETIGT"
  }
 },
 "expect_outcome": "BLOCKED_EXTERNAL",
 "expect_rule": "PRE-G8-5"
}
