{
 "schema_version": "3.0",
 "id": "GC-G1-019",
 "gate": "GATE-G1",
 "description": "Agrar gesperrt und Rückfall bei KT-05",
 "facts": {
  "gate_g0": "PASS",
  "harness_exit_code": 0,
  "protocol_complete": true,
  "kt_01": "BESTANDEN",
  "kt_02": "BESTANDEN",
  "kt_03": "BESTANDEN",
  "kt_04": "BESTANDEN",
  "kt_05": "RUECKFALL",
  "kt_06": "BESTANDEN",
  "kt_07": "BESTANDEN",
  "kt_08": "GESCHEITERT",
  "kt_09": "BESTANDEN",
  "kt_10": "BESTANDEN",
  "kt_11": "BESTANDEN",
  "kt_12": "BESTANDEN",
  "kt_13": "BESTANDEN",
  "kt_14": "BESTANDEN",
  "kt_15": "BESTANDEN",
  "kt_16": "BESTANDEN",
  "inputs": {
   "X-OP-CAPITAL": "BESTAETIGT",
   "X-OP-RISK-ACCEPT": "BESTAETIGT",
   "X-OP-DLC-MODE": "BESTAETIGT",
   "X-OP-RATE": "BESTAETIGT",
   "X-OP-BUDGET": "BESTAETIGT",
   "X-OP-CFD": "BESTAETIGT",
   "X-SCOPE-THIRD": "BESTAETIGT",
   "X-EQ-INDEX": "BESTAETIGT",
   "X-INF-ZONES": "BESTAETIGT",
   "X-INF-VPS": "BESTAETIGT",
   "X-ORG-RISK": "BESTAETIGT",
   "X-ORG-DEPUTY": "BESTAETIGT",
   "X-BRK-ACCOUNT": "BESTAETIGT",
   "X-BRK-CONTRACTS": "BESTAETIGT",
   "X-BRK-FEES": "BESTAETIGT",
   "X-BRK-MARGIN": "BESTAETIGT",
   "X-BRK-LIQ": "BESTAETIGT",
   "X-BRK-NACHSCHUSS": "BESTAETIGT",
   "X-BRK-API": "BESTAETIGT",
   "X-BRK-DEMO": "BESTAETIGT",
   "X-BRK-INTEREST": "BESTAETIGT",
   "X-BRK-ALT": "BESTAETIGT",
   "X-DATA-ND": "BESTAETIGT",
   "X-DATA-LIC": "BESTAETIGT",
   "X-DATA-VOL": "BESTAETIGT",
   "X-DATA-LIQ": "BESTAETIGT",
   "X-DATA-HIST": "BESTAETIGT",
   "X-EXEC-TCA": "BESTAETIGT",
   "X-CFD-SPREADS": "BESTAETIGT",
   "X-AI-DPA": "BESTAETIGT",
   "X-LEGAL-01": "BESTAETIGT",
   "X-TAX-01": "BESTAETIGT",
   "X-V1-PRODUCTS": "BESTAETIGT",
   "X-REVIEW": "BESTAETIGT"
  }
 },
 "expect_outcome": "PASS",
 "expect_rule": "G1-R5",
 "expect_flags": [
  "RUECKFALL_AKTIV",
  "UNIVERSUM_VERKLEINERT"
 ]
}
