{
 "schema_version": "3.0",
 "id": "GC-G0-102",
 "gate": "GATE-G0",
 "description": "Rechenwerte 24.09.2026, Eingaben hypothetisch bestätigt: registrierte Familie in H5 bei Referenzstufe",
 "facts": {
  "operator_decisions_recorded": true,
  "calculators_exit_code": 0,
  "calculators_check_passed": true,
  "buy_vs_build_signed": true,
  "variant_decision": "PROFILE_NOT_ADMISSIBLE",
  "finding_class": "PROFILE_NOT_ADMISSIBLE",
  "p_npv_positive": 0.376,
  "variant_requires_operator_decision": false,
  "inputs": {
   "X-OP-CAPITAL": "BESTAETIGT",
   "X-OP-RISK-ACCEPT": "BESTAETIGT",
   "X-OP-DLC-MODE": "BESTAETIGT",
   "X-OP-RATE": "BESTAETIGT",
   "X-OP-BUDGET": "BESTAETIGT",
   "X-OP-CFD": "BESTAETIGT",
   "X-SCOPE-THIRD": "BESTAETIGT",
   "X-EQ-INDEX": "BESTAETIGT",
   "X-INF-ZONES": "BESTAETIGT",
   "X-INF-VPS": "BESTAETIGT",
   "X-ORG-RISK": "BESTAETIGT",
   "X-ORG-DEPUTY": "BESTAETIGT",
   "X-BRK-ACCOUNT": "BESTAETIGT",
   "X-BRK-CONTRACTS": "BESTAETIGT",
   "X-BRK-FEES": "BESTAETIGT",
   "X-BRK-MARGIN": "BESTAETIGT",
   "X-BRK-LIQ": "BESTAETIGT",
   "X-BRK-NACHSCHUSS": "BESTAETIGT",
   "X-BRK-API": "BESTAETIGT",
   "X-BRK-DEMO": "BESTAETIGT",
   "X-BRK-INTEREST": "BESTAETIGT",
   "X-BRK-ALT": "BESTAETIGT",
   "X-DATA-ND": "BESTAETIGT",
   "X-DATA-LIC": "BESTAETIGT",
   "X-DATA-VOL": "BESTAETIGT",
   "X-DATA-LIQ": "BESTAETIGT",
   "X-DATA-HIST": "BESTAETIGT",
   "X-EXEC-TCA": "BESTAETIGT",
   "X-CFD-SPREADS": "BESTAETIGT",
   "X-AI-DPA": "BESTAETIGT",
   "X-LEGAL-01": "BESTAETIGT",
   "X-TAX-01": "BESTAETIGT",
   "X-V1-PRODUCTS": "BESTAETIGT",
   "X-REVIEW": "BESTAETIGT"
  }
 },
 "expect_outcome": "FAIL",
 "expect_rule": "G0-R3",
 "facts_source": "financials/decision_montecarlo_results.json#/variants_V0_V4/5000000"
}
